<?xml version="1.0" encoding="UTF-8"?>
<!--Sample XML file generated by XMLSpy v2020 sp1 (x64) (http://www.altova.com)-->
<Document xmlns:xsi="http://www.w3.org/2001/XMLSchema-instance" xsi:noNamespaceSchemaLocation="AMS_846_XML_V002.xsd">
	<DocumentType>846</DocumentType>
	<Version>V002</Version>
	<ClientCode>WI</ClientCode>
	<DataDate>2018-01-23</DataDate>
	<DataTime>09:30:47-08:00</DataTime>
	<InventoryItems>
		<InventoryItem>
			<ItemNumber>6789054321</ItemNumber>
			<UPC>8976542312</UPC>
			<LocationQtys>
				<LocationQty>
					<Location>Main</Location>
					<QTYAvailable>10</QTYAvailable>
					<QTYInWarehouse>10</QTYInWarehouse>
				</LocationQty>
				<LocationQty>
					<Location>SCO3</Location>
					<QTYAvailable>12</QTYAvailable>
					<QTYInWarehouse>12</QTYInWarehouse>
				</LocationQty>
			</LocationQtys>
		</InventoryItem>
		<InventoryItem>
			<ItemNumber>8763042342</ItemNumber>
			<UPC>8976543567</UPC>
			<LocationQtys>
				<LocationQty>
					<Location>Main</Location>
					<QTYAvailable>99</QTYAvailable>
					<QTYInWarehouse>99</QTYInWarehouse>
				</LocationQty>
				<LocationQty>
					<Location>SCO3</Location>
					<QTYAvailable>10</QTYAvailable>
					<QTYInWarehouse>10</QTYInWarehouse>
				</LocationQty>
			</LocationQtys>
		</InventoryItem>
	</InventoryItems>
</Document>
